{
  "$schema": "../../schema/background.schema.json",
  "id": "wanderer",
  "name": "Andarilho",
  "source": {
    "book": "Livro do Jogador 2024",
    "language": "pt-BR",
    "chapter": 4,
    "chapterTitle": "Origens dos Personagens",
    "pdfPath": "doc/livro-jogador.pdf",
    "pdfPages": [
      177,
      185
    ],
    "extractedAt": "2026-06-25T23:29:50.537Z"
  },
  "description": "Você cresceu nas ruas cercado por rejeitados igualmente malfadados, alguns deles amigos e outros rivais. Você dormia onde podia e fazia bicos por comida. Às vezes, quando a fome se tornava insuportável, você recorria ao furto. Ainda assim, você nunca perdeu seu orgulho e nunca abandonou a esperança. O destino ainda não terminou com você.",
  "abilityOptions": [
    "Destreza",
    "Sabedoria",
    "Carisma"
  ],
  "feat": {
    "id": "lucky",
    "name": "Sortudo"
  },
  "skills": [
    "Furtividade",
    "Intuição"
  ],
  "toolProficiency": {
    "description": "Ferramentas de Ladrão",
    "kind": "fixed"
  },
  "equipment": {
    "goldOption": "50 PO",
    "packages": [
      {
        "id": "a",
        "label": "A",
        "items": [
          "2 Adagas",
          "Ferramentas de Ladrão",
          "Kit de Jogos (qualquer um)",
          "2 Algibeiras",
          "Roupas de Viagem",
          "Saco de Dormir"
        ],
        "gold": "16 PO"
      }
    ]
  }
}
