{
  "$schema": "../../schema/background.schema.json",
  "id": "charlatan",
  "name": "Charlatão",
  "source": {
    "book": "Livro do Jogador 2024",
    "language": "pt-BR",
    "chapter": 4,
    "chapterTitle": "Origens dos Personagens",
    "pdfPath": "doc/livro-jogador.pdf",
    "pdfPages": [
      177,
      185
    ],
    "extractedAt": "2026-06-25T23:29:50.537Z"
  },
  "description": "Assim que você atingiu a idade para pedir uma cerveja, escolheu seu banquinho favorito em cada taverna a quinze quilômetros de onde nasceu. Ao percorrer o circuito de bares e botequins, aprendeu a lidar com os infelizes em busca de mentiras reconfortantes — talvez uma poção falsa ou registros de ancestralidade forjados.",
  "abilityOptions": [
    "Destreza",
    "Constituição",
    "Carisma"
  ],
  "feat": {
    "id": "skilled",
    "name": "Habilidoso"
  },
  "skills": [
    "Enganação",
    "Prestidigitação"
  ],
  "toolProficiency": {
    "description": "Kit de Falsificação",
    "kind": "fixed"
  },
  "equipment": {
    "goldOption": "50 PO",
    "packages": [
      {
        "id": "a",
        "label": "A",
        "items": [
          "Kit de Falsificação",
          "Fantasia",
          "Roupas Finas"
        ],
        "gold": "15 PO"
      }
    ]
  }
}
